1	this is the case of a pregnant premise being wasted by a script that takes few chances and manages to insult the intelligence of everyone in the audience .
0	is office work really as alienating as 'bartleby' so effectively makes it ?
0	horns and halos benefits from serendipity but also reminds us of our own responsibility to question what is told as the truth .
1	heavy-handed exercise in time-vaulting literary pretension .
0	easily one of the best and most exciting movies of the year .
1	you . . . get a sense of good intentions derailed by a failure to seek and strike just the right tone .
1	johnson has , in his first film , set himself a task he is not nearly up to .
0	' . . . both hokey and super-cool , and definitely not in a hurry , so sit back , relax and have a few laughs while the little ones get a fuzzy treat . '
0	one of recent memory's most thoughtful films about art , ethics , and the cost of moral compromise .
1	a supernatural mystery that doesn't know whether it wants to be a suspenseful horror movie or a weepy melodrama . it ends up being neither , and fails at both endeavors .
0	jason x has cheesy effects and a hoary plot , but its macabre , self-deprecating sense of humor makes up for a lot .
0	a literate presentation that wonderfully weaves a murderous event in 1873 with murderous rage in 2002 .
0	[drumline] is entertaining for what it does , and admirable for what it doesn't do .
0	this ready-made midnight movie probably won't stand the cold light of day , but under the right conditions , it's goofy ( if not entirely wholesome ) fun .
0	sparkling , often hilarious romantic jealousy comedy . . . attal looks so much like a young robert deniro that it seems the film should instead be called 'my husband is travis bickle' .
1	the actors improvise and scream their way around this movie directionless , lacking any of the rollicking dark humor so necessary to make this kind of idea work on screen .
1	affleck merely creates an outline for a role he still needs to grow into , a role that ford effortlessly filled with authority .
1	all movie long , city by the sea swings from one approach to the other , but in the end , it stays in formula -- which is a waste of de niro , mcdormand and the other good actors in the cast .
1	. . . think of it as american pie on valium .
0	a delirious celebration of the female orgasm .
0	beautifully produced .
1	billy crystal and robert de niro sleepwalk through vulgarities in a sequel you can refuse .
0	a beautiful and haunting examination of the stories we tell ourselves to make sense of the mundane horrors of the world .
1	there's too much falseness to the second half , and what began as an intriguing look at youth fizzles into a dull , ridiculous attempt at heart-tugging .
1	most fish stories are a little peculiar , but this is one that should be thrown back in the river .
1	the action scenes have all the suspense of a 20-car pileup , while the plot holes are big enough for a train car to drive through -- if kaos hadn't blown them all up .
1	the plan to make enough into an inspiring tale of survival wrapped in the heart-pounding suspense of a stylish psychological thriller' has flopped as surely as a soufflé gone wrong .
0	a fascinating , dark thriller that keeps you hooked on the delicious pulpiness of its lurid fiction .
0	an overly melodramatic but somewhat insightful french coming-of-age film . . .
0	a sensitive , cultivated treatment of greene's work as well as a remarkably faithful one .
1	barely manages for but a few seconds over its seemingly eternal running time to pique your interest , your imagination , your empathy or anything , really , save your disgust and your indifference .
0	this is unusual , food-for-thought cinema that's as entertaining as it is instructive .
0	the message of such reflections--intentional or not--is that while no art grows from a vacuum , many artists exist in one .
1	instead of making his own style , director marcus adams just copies from various sources  good sources , bad mixture
1	outside of burger's desire to make some kind of film , it's really unclear why this project was undertaken
0	this warm and gentle romantic comedy has enough interesting characters to fill several movies , and its ample charms should win over the most hard-hearted cynics .
1	with its parade of almost perpetually wasted characters . . . margarita feels like a hazy high that takes too long to shake .
1	entertaining enough , but nothing new
0	i'd watch these two together again in a new york minute .
0	has a lot of the virtues of eastwood at his best .
1	madonna has made herself over so often now , there's apparently nothing left to work with , sort of like michael jackson's nose .
1	it's fitfully funny but never really takes off .
1	often silly  and gross  but it's rarely as moronic as some campus gross-out films .
1	scores no points for originality , wit , or intelligence . it's a cookie-cutter movie , a cut-and-paste job .
0	[a] wonderfully loopy tale of love , longing , and voting .
0	adam sandler ! in an art film !
0	the script is smart , not cloying .
0	the movie exists for its soccer action and its fine acting .
0	a hallmark film in an increasingly important film industry and worth the look .
1	a few nonbelievers may rethink their attitudes when they see the joy the characters take in this creed , but skeptics aren't likely to enter the theater .
0	while maintaining the appearance of clinical objectivity , this sad , occasionally horrifying but often inspiring film is among wiseman's warmest .
1	was i scared ? only at the prospect of beck's next project . let's see , a haunted house , a haunted ship , what's next . . . ghost blimp ?
1	any reasonably creative eighth-grader could have written a more credible script , though with the same number of continuity errors .
1	seeing as the film lacks momentum and its position remains mostly undeterminable , the director's experiment is a successful one .
0	moretti . . . is the rare common-man artist who's wise enough to recognize that there are few things in this world more complex -- and , as it turns out , more fragile -- than happiness .
1	in moonlight mile , no one gets shut out of the hug cycle .
1	not counting a few gross-out comedies i've been trying to forget , this is the first film in a long time that made me want to bolt the theater in the first 10 minutes .
0	a beautifully observed character piece .
1	i'm sure the filmmakers found this a remarkable and novel concept , but anybody who has ever seen an independent film can report that it is instead a cheap cliché .
0	a wild , endearing , masterful documentary .
1	so few movies explore religion that it's disappointing to see one reduce it to an idea that fits in a sampler .
0	a densely constructed , highly referential film , and an audacious return to form that can comfortably sit among jean-luc godard's finest work .
0	a moving and solidly entertaining comedy/drama that should bolster director and co-writer juan josé campanella's reputation in the united states .
0	touché !
1	a nightmare date with a half-formed wit done a great disservice by a lack of critical distance and a sad trust in liberal arts college bumper sticker platitudes .
1	when not obscured by the booming bass-heavy soundtrack , the conversation presents the kind of linguistic fumbling not heard since macy gray's game of chinese whispers with mr bean .
0	this odd , poetic road movie , spiked by jolts of pop music , pretty much takes place in morton's ever-watchful gaze -- and it's a tribute to the actress , and to her inventive director , that the journey is such a mesmerizing one .
0	writer/ director m . night shyamalan's ability to pull together easily accessible stories that resonate with profundity is undeniable .
1	the character of zigzag is not sufficiently developed to support a film constructed around him .
0	the grey zone gives voice to a story that needs to be heard in the sea of holocaust movies . . . but the film suffers from its own difficulties .
1	. . . unlikable , uninteresting , unfunny , and completely , utterly inept .
0	it provides a grim , upsetting glimpse at the lives of some of the 1 . 2 million palestinians who live in the crowded cities and refugee camps of gaza .
1	a movie that hovers somewhere between an acute character study and a trite power struggle .
0	the movie's eventual success should be credited to dennis quaid , in fighting trim shape as an athlete as well as an actor
0	polished , well-structured film .
1	broomfield's style of journalism is hardly journalism at all , and even those with an avid interest in the subject will grow impatient .
0	at its worst the screenplay is callow , but at its best it is a young artist's thoughtful consideration of fatherhood .
0	one of the greatest films i've ever seen .
0	it's definitely an improvement on the first blade , since it doesn't take itself so deadly seriously .
0	the limited sets and small confined and dark spaces also are homages to a classic low-budget film noir movie .
0	the ingenious construction ( adapted by david hare from michael cunningham's novel ) constantly flows forwards and back , weaving themes among three strands which allow us to view events as if through a prism
0	it's crafty , energetic and smart -- the kid is sort of like a fourteen-year old ferris bueller .
0	francophiles will snicker knowingly and you'll want to slap them .
0	the most compelling wiseman epic of recent years .
1	there are cheesy backdrops , ridiculous action sequences , and many tired jokes about men in heels .
0	the result is more depressing than liberating , but it's never boring .
0	an entertaining , colorful , action-filled crime story with an intimate heart .
1	much of the digitally altered footage appears jagged , as if filmed directly from a television monitor , while the extensive use of stock footage quickly becomes a tiresome cliché .
0	a miraculous movie , i'm going home is so slight , yet overflows with wisdom and emotion .
1	while much of the cast has charm -- especially allodi and nolden -- the performers are sunk by the film's primitive approach to the mechanics of comedy .
1	just like every other seagal movie , only louder and without that silly ponytail .
1	choppy editing and too many repetitive scenes spoil what could have been an important documentary about stand-up comedy .
0	the film is an enjoyable family film -- pretty much aimed at any youngster who loves horses .
0	i found myself liking the film , though in this case one man's treasure could prove to be another man's garbage .
0	the tonal shifts are jolting , and though wen's messages are profound and thoughtfully delivered , more thorough transitions would have made the film more cohesive .
0	kosminsky . . . puts enough salt into the wounds of the tortured and self-conscious material to make it sting .
0	this isn't exactly profound cinema , but it's good-natured and sometimes quite funny .
1	a live-action cartoon , a fast-moving and cheerfully simplistic 88 minutes of exaggerated action put together with the preteen boy in mind .
0	the fascination comes in the power of the huston performance , which seems so larger than life and yet so fragile , and in the way the ivan character accepts the news of his illness so quickly but still finds himself unable to react .
1	the gantzes' interviews tend to let the guys off the hook .
0	'interesante y disfrutable trabajo gracias a que prescinde del clásico elemento estadounidense patriotero y manipulador . '
0	spider-man is in the same category as x-men - occasionally brilliant but mostly average , showing signs of potential for the sequels , but not giving us much this time around .
0	there aren't many conclusive answers in the film , but there is an interesting story of pointed personalities , courage , tragedy and the little guys vs . the big guys .
0	there is no solace here , no entertainment value , merely a fierce lesson in where filmmaking can take us .
1	another useless recycling of a brutal mid-'70s american sports movie .
1	. . . too dull to enjoy .
1	verbinski substitutes atmosphere for action , tedium for thrills .
1	children , christian or otherwise , deserve to hear the full story of jonah's despair -- in all its agonizing , catch-22 glory -- even if they spend years trying to comprehend it .
1	imagine a really bad community theater production of west side story without the songs .
1	another wholly unnecessary addition to the growing , moldering pile of , well , extreme stunt pictures .
0	as a good old-fashioned adventure for kids , spirit : stallion of the cimarron is a winner .
0	the sundance film festival has become so buzz-obsessed that fans and producers descend upon utah each january to ferret out the next great thing . 'tadpole' was one of the films so declared this year , but it's really more of the next pretty good thing .
1	the elements were all there but lack of a pyschological center knocks it flat .
1	there's no point in extracting the bare bones of byatt's plot for purposes of bland hollywood romance .
0	an infinitely wittier version of the home alone formula .
1	it's not exactly worth the bucks to expend the full price for a date , but when it comes out on video , it's well worth a rental .
0	a fascinating glimpse into an insular world that gives the lie to many clichés and showcases a group of dedicated artists .
1	there's undeniable enjoyment to be had from films crammed with movie references , but the fun wears thin -- then out -- when there's nothing else happening .
0	a film about female friendship that men can embrace and women will talk about for hours .
0	" 13 conversations about one thing " is an intelligent flick that examines many different ideas from happiness to guilt in an intriguing bit of storytelling .
0	the trinity assembly approaches the endeavor with a shocking lack of irony , and george ratliff's documentary , hell house , reflects their earnestness  which makes for a terrifying film .
0	the series' message about making the right choice in the face of tempting alternatives remains prominent , as do the girls' amusing personalities .
0	for all its brooding quality , ash wednesday is suspenseful and ultimately unpredictable , with a sterling ensemble cast .
1	a beyond-lame satire , teddy bears' picnic ranks among the most pitiful directing debuts by an esteemed writer-actor .
1	with the exception of some fleetingly amusing improvisations by cedric the entertainer as perry's boss , there isn't a redeeming moment here .
0	vampire epic succeeds as spooky action-packed trash of the highest order .
1	it's a shame that the storyline and its underlying themes . . . finally seem so impersonal or even shallow .
0	angela gheorghiu as famous prima donna floria tosca , roberto alagna as her lover mario cavaradossi , and ruggero as the villainous , lecherous police chief scarpia , all sing beautifully and act adequately .
1	just dreadful . i don't blame eddie murphy but shouldn't owen wilson know a movie must have a story and a script ?
1	it's not a bad plot ; but , unfortunately , the movie is nowhere near as refined as all the classic dramas it borrows from .
0	" spider-man is better than any summer blockbuster we had to endure last summer , and hopefully , sets the tone for a summer of good stuff . if you're a comic fan , you can't miss it . if you're not , you'll still have a good time . "
1	the movie eventually snaps under the strain of its plot contrivances and its need to reassure .
0	pete's screenplay manages to find that real natural , even-flowing tone that few movies are able to accomplish .
1	woefully pretentious .
0	at its best , the good girl is a refreshingly adult take on adultery . . .
1	[less a movie than] an appalling , odoriferous thing . . . so rotten in almost every single facet of production that you'll want to crawl up your own * * * in embarrassment .
0	one of the best silly horror movies of recent memory , with some real shocks in store for unwary viewers .
1	jonathan parker's bartleby should have been the be-all-end-all of the modern-office anomie films .
1	its strengths and weaknesses play off each other virtually to a stand-off , with the unfortunate trump card being the dreary mid-section of the film .
1	the characters seem one-dimensional , and the film is superficial and will probably be of interest primarily to its target audience .
1	it's a drag how nettelbeck sees working women -- or at least this working woman -- for whom she shows little understanding .
1	as social exposé , skins has its heart in the right place , but that's not much to hang a soap opera on .
1	too lazy to take advantage of its semi-humorous premise .
0	takes a simple premise and carries it to unexpected heights .
1	the film contains no good jokes , no good scenes , barely a moment when carvey's saturday night live-honed mimicry rises above the level of embarrassment .
1	there is nothing redeeming about this movie .
1	can be classified as one of those 'alternate reality' movies . . . except that it would have worked so much better dealing in only one reality .
0	a rather brilliant little cult item : a pastiche of children's entertainment , superhero comics , and japanese animation .
0	morton is a great actress portraying a complex character , but morvern callar grows less compelling the farther it meanders from its shocking start .
1	this is a train wreck of an action film -- a stupefying attempt by the filmmakers to force-feed james bond into the mindless xxx mold and throw 40 years of cinematic history down the toilet in favor of bright flashes and loud bangs .
1	worthless , from its pseudo-rock-video opening to the idiocy of its last frames .
1	[seagal's] strenuous attempt at a change in expression could very well clinch him this year's razzie .
0	an operatic , sprawling picture that's entertainingly acted , magnificently shot and gripping enough to sustain most of its 170-minute length .
1	the pace of the film is very slow ( for obvious reasons ) and that too becomes off-putting .
1	as if drop dead gorgeous wasn't enough , this equally derisive clunker is fixated on the spectacle of small-town competition .
1	even those of a single digit age will be able to recognize that this story is too goofy . . . even for disney .
1	anemic , pretentious .
0	at times the guys taps into some powerful emotions , but this kind of material is more effective on stage . it's not a motion picture ; it's an utterly static picture .
0	michael gerbosi's script is economically packed with telling scenes .
1	costner's warm-milk persona is just as ill-fitting as shadyac's perfunctory directing chops , and some of the more overtly silly dialogue would sink laurence olivier .
0	quite funny for the type of movie it is . . .
0	alternating between facetious comic parody and pulp melodrama , this smart-aleck movie . . . tosses around some intriguing questions about the difference between human and android life .
0	by its modest , straight-ahead standards , undisputed scores a direct hit .
1	. . . the efforts of its star , kline , to lend some dignity to a dumb story are for naught .
1	flashy gadgets and whirling fight sequences may look cool , but they can't distract from the flawed support structure holding equilibrium up .
1	an already thin story boils down to surviving invaders seeking an existent anti-virus . if only there were one for this kind of movie .
0	quite simply , a joy to watch and--especially--to listen to .
1	you'd be hard put to find a movie character more unattractive or odorous [than leon] .
1	too much of it feels unfocused and underdeveloped .
1	these spiders can outrun a motorcycle and wrap a person in a sticky cocoon in seconds , but they fall short of being interesting or entertaining .
0	at times auto focus feels so distant you might as well be watching it through a telescope . yet in its own aloof , unreachable way it's so fascinating you won't be able to look away for a second .
1	if jews were catholics , this would be catechism
1	the tug-of-war at the core of beijing bicycle becomes weighed down with agonizing contrivances , overheated pathos and long , wistful gazes .
1	boring and meandering .
0	drug abuse , infidelity and death aren't usually comedy fare , but turpin's film allows us to chuckle through the angst .
0	[f]rom the performances and the cinematography to the outstanding soundtrack and unconventional narrative , the film is blazingly alive and admirable on many levels .
0	its cast full of caffeinated comedy performances more than make up for its logical loopholes , which fly by so fast there's no time to think about them anyway .
1	decent but dull .
1	the secrets of time travel will have been discovered , indulged in and rejected as boring before i see this piece of crap again .
1	consider the film a celluloid litmus test for the intellectual and emotional pedigree of your date and a giant step backward for a director i admire .
0	a meatier deeper beginning and/or ending would have easily tipped this film into the " a " range , as is , it's a very very strong " b+ . " i love the robust middle of this picture .
0	[villeneuve] seems to realize intuitively that even morality is reduced to an option by the ultimate mysteries of life and death .
0	renner carries much of the film with a creepy and dead-on performance .
1	the problem is the needlessly poor quality of its archival prints and film footage . the images lack contrast , are murky and are frequently too dark to be decipherable .
1	plays like a checklist of everything rob reiner and his cast were sending up .
0	an enthralling aesthetic experience , one that's steeped in mystery and a ravishing , baroque beauty .
1	fear permeates the whole of stortelling , todd solondz' oftentimes funny , yet ultimately cowardly autocritique .
1	a cautionary tale about the folly of superficiality that is itself endlessly superficial .
0	an enjoyable film for the family , amusing and cute for both adults and kids .
0	norton is magnetic as graham .
0	though the film's scenario is certainly not earthshaking , this depiction of fluctuating female sexuality has two winning lead performances and charm to spare .
0	an intriguing cinematic omnibus and round-robin that occasionally is more interesting in concept than in execution .
1	it's a grab bag of genres that don't add up to a whole lot of sense .
0	sound the trumpets : for the first time since desperately seeking susan , madonna doesn't suck as an actress .
0	a poignant and compelling story about relationships , food of love takes us on a bumpy but satisfying journey of the heart .
1	extremely bad .
1	crikey indeed .
0	witherspoon puts to rest her valley-girl image , but it's dench who really steals the show .
1	you're too conscious of the effort it takes to be this spontaneous .
0	although it includes a fair share of dumb drug jokes and predictable slapstick , " orange county " is far funnier than it would seem to have any right to be .
